{
  "version_esquema": "StepVote_v1",
  "caso_id": "CASE_20260311_ACLS",
  "ticker": "ACLS",
  "fecha_caso": "2026-03-11",
  "step_name": "BULL",
  "operation": "PIPELINE",
  "mode": "deterministic_only",
  "subject_type": "single_artifact",
  "schema_name": "AgentReport_v1",
  "score_raw_0_100": 98.0,
  "rules": [
    {
      "name": "schema_valid",
      "weight": 1.0,
      "score_raw_0_100": 100.0,
      "passed": true,
      "details": null
    },
    {
      "name": "critical_fields_completeness",
      "weight": 1.0,
      "score_raw_0_100": 100.0,
      "passed": true,
      "details": null
    },
    {
      "name": "null_ratio",
      "weight": 1.0,
      "score_raw_0_100": 94.0,
      "passed": true,
      "details": "nulls=31/517 (6.00%)"
    }
  ],
  "context": {
    "critical_fields_checked": 4,
    "critical_fields": [
      "resumen_ejecutivo.veredicto_role_local",
      "resumen_ejecutivo.confianza_0_1",
      "claims",
      "log.autochequeos"
    ],
    "canonical_step_name": "BULL",
    "subject_kind": "fusion",
    "vote_group_id": "2bb1f895-a874-4165-bb63-85b7d57d6223"
  },
  "_meta": {
    "created_at_utc": "2026-03-11T19:57:19+00:00",
    "config_hash": "b196e415cb8b7ef6f9091b05a4101873f0fd8390d51ce767a7c4f02a1474f4fe",
    "model": "opus",
    "backend": "claude",
    "artifact_file": "casos/ACLS/2026-03-11/_votes/StepVote_v1_BULL_20260311T195719_0000.json"
  }
}