{
  "version_esquema": "StepVote_v1",
  "caso_id": "CASE_20260217_ACVA",
  "ticker": "ACVA",
  "fecha_caso": "2026-02-17",
  "step_name": "BULL__model_gemini",
  "operation": "PIPELINE",
  "mode": "deterministic_only",
  "subject_type": "single_artifact",
  "schema_name": "AgentReport_v1",
  "score_raw_0_100": 98.94,
  "rules": [
    {
      "name": "schema_valid",
      "weight": 1.0,
      "score_raw_0_100": 100.0,
      "passed": true,
      "details": null
    },
    {
      "name": "critical_fields_completeness",
      "weight": 1.0,
      "score_raw_0_100": 100.0,
      "passed": true,
      "details": null
    },
    {
      "name": "null_ratio",
      "weight": 1.0,
      "score_raw_0_100": 96.81,
      "passed": true,
      "details": "nulls=6/188 (3.19%)"
    }
  ],
  "context": {
    "critical_fields_checked": 4,
    "critical_fields": [
      "resumen_ejecutivo.veredicto_role_local",
      "resumen_ejecutivo.confianza_0_1",
      "claims",
      "log.autochequeos"
    ],
    "canonical_step_name": "BULL"
  },
  "_meta": {
    "created_at_utc": "2026-02-19T11:48:42+00:00",
    "config_hash": "156c91552bdcb2695b10fffd6cb82cfced011aa00be90d0420e2de130dab9054",
    "model": "gemini",
    "backend": "gemini",
    "artifact_file": "casos/ACVA/2026-02-17/_votes/StepVote_v1_BULL__model_gemini_20260219T114842_0000.json"
  }
}