{
  "version_esquema": "StepVote_v1",
  "caso_id": "CASE_20260226_GCT",
  "ticker": "GCT",
  "fecha_caso": "2026-02-26",
  "step_name": "BULL__model_claude",
  "operation": "PIPELINE",
  "mode": "deterministic_only",
  "subject_type": "single_artifact",
  "schema_name": "AgentReport_v1",
  "score_raw_0_100": 98.3,
  "rules": [
    {
      "name": "schema_valid",
      "weight": 1.0,
      "score_raw_0_100": 100.0,
      "passed": true,
      "details": null
    },
    {
      "name": "critical_fields_completeness",
      "weight": 1.0,
      "score_raw_0_100": 100.0,
      "passed": true,
      "details": null
    },
    {
      "name": "null_ratio",
      "weight": 1.0,
      "score_raw_0_100": 94.91,
      "passed": true,
      "details": "nulls=20/393 (5.09%)"
    }
  ],
  "context": {
    "critical_fields_checked": 4,
    "critical_fields": [
      "resumen_ejecutivo.veredicto_role_local",
      "resumen_ejecutivo.confianza_0_1",
      "claims",
      "log.autochequeos"
    ],
    "canonical_step_name": "BULL",
    "subject_kind": "per_model",
    "vote_group_id": "019e2e71-24e0-4d49-a539-36f86220346c"
  },
  "_meta": {
    "created_at_utc": "2026-02-26T15:40:58+00:00",
    "config_hash": "b196e415cb8b7ef6f9091b05a4101873f0fd8390d51ce767a7c4f02a1474f4fe",
    "model": "claude",
    "backend": "claude",
    "artifact_file": "casos/GCT/2026-02-26/_votes/StepVote_v1_BULL__model_claude_20260226T154058_0000.json"
  }
}