{
  "version_esquema": "StepVote_v1",
  "caso_id": "CASE_20260223_GCT",
  "ticker": "GCT",
  "fecha_caso": "2026-02-23",
  "step_name": "FORENSIC_SCORING",
  "operation": "PIPELINE",
  "mode": "deterministic_only",
  "subject_type": "single_artifact",
  "schema_name": "AgentReport_v1",
  "score_raw_0_100": 99.62,
  "rules": [
    {
      "name": "schema_valid",
      "weight": 1.0,
      "score_raw_0_100": 100.0,
      "passed": true,
      "details": null
    },
    {
      "name": "critical_fields_completeness",
      "weight": 1.0,
      "score_raw_0_100": 100.0,
      "passed": true,
      "details": null
    },
    {
      "name": "null_ratio",
      "weight": 1.0,
      "score_raw_0_100": 98.85,
      "passed": true,
      "details": "nulls=7/608 (1.15%)"
    }
  ],
  "context": {
    "critical_fields_checked": 4,
    "critical_fields": [
      "resumen_ejecutivo.veredicto_role_local",
      "resumen_ejecutivo.confianza_0_1",
      "claims",
      "log.autochequeos"
    ],
    "canonical_step_name": "FORENSIC_SCORING",
    "subject_kind": "fusion",
    "vote_group_id": "a833fd64-0169-46c8-a815-cd8eec5ebdea"
  },
  "_meta": {
    "created_at_utc": "2026-02-24T16:17:31+00:00",
    "config_hash": "b196e415cb8b7ef6f9091b05a4101873f0fd8390d51ce767a7c4f02a1474f4fe",
    "model": "gpt-5.3-codex",
    "backend": "codex",
    "artifact_file": "casos/GCT/2026-02-23/_votes/StepVote_v1_FORENSIC_SCORING_20260224T161731_0000.json"
  }
}