{
  "version_esquema": "StepVote_v1",
  "caso_id": "CASE_20260219_TZOO",
  "ticker": "TZOO",
  "fecha_caso": "2026-02-19",
  "step_name": "ARBITRO__model_claude",
  "operation": "PIPELINE",
  "mode": "deterministic_only",
  "subject_type": "single_artifact",
  "schema_name": "DecisionPacket_v2",
  "score_raw_0_100": 65.79,
  "rules": [
    {
      "name": "schema_valid",
      "weight": 1.0,
      "score_raw_0_100": 100.0,
      "passed": true,
      "details": null
    },
    {
      "name": "critical_fields_completeness",
      "weight": 1.0,
      "score_raw_0_100": 0.0,
      "passed": false,
      "details": "missing=['resumen_ejecutivo.decision', 'resumen_ejecutivo.confianza_global_0_1', 'gates.data_quality_gate.status', 'gates.non_speculative_gate.status', 'decision_probabilistica.probabilidad_exito_0_1']"
    },
    {
      "name": "null_ratio",
      "weight": 1.0,
      "score_raw_0_100": 97.37,
      "passed": true,
      "details": "nulls=1/38 (2.63%)"
    }
  ],
  "context": {
    "critical_fields_checked": 5,
    "critical_fields": [
      "resumen_ejecutivo.decision",
      "resumen_ejecutivo.confianza_global_0_1",
      "gates.data_quality_gate.status",
      "gates.non_speculative_gate.status",
      "decision_probabilistica.probabilidad_exito_0_1"
    ],
    "canonical_step_name": "ARBITRO"
  },
  "_meta": {
    "created_at_utc": "2026-02-19T13:03:44+00:00",
    "config_hash": "156c91552bdcb2695b10fffd6cb82cfced011aa00be90d0420e2de130dab9054",
    "model": "claude",
    "backend": "claude",
    "artifact_file": "casos/TZOO/2026-02-19/_votes/StepVote_v1_ARBITRO__model_claude_20260219T130344_0000.json"
  }
}