{
  "version_esquema": "StepVote_v1",
  "caso_id": "CASE_20260224_BOBS",
  "ticker": "BOBS",
  "fecha_caso": "2026-02-24",
  "step_name": "CATALYST_DETECTION__model_gemini",
  "operation": "PIPELINE",
  "mode": "deterministic_only",
  "subject_type": "single_artifact",
  "schema_name": "CatalystDetection_v1",
  "score_raw_0_100": 100.0,
  "rules": [
    {
      "name": "schema_valid",
      "weight": 1.0,
      "score_raw_0_100": 100.0,
      "passed": true,
      "details": null
    },
    {
      "name": "critical_fields_completeness",
      "weight": 1.0,
      "score_raw_0_100": 100.0,
      "passed": true,
      "details": "no_critical_fields_configured"
    },
    {
      "name": "null_ratio",
      "weight": 1.0,
      "score_raw_0_100": 100.0,
      "passed": true,
      "details": "nulls=0/140 (0.00%)"
    }
  ],
  "context": {
    "critical_fields_checked": 0,
    "critical_fields": [],
    "canonical_step_name": "CATALYST_DETECTION",
    "subject_kind": "per_model",
    "vote_group_id": "c1c3c751-fac1-4a52-97b6-5250cbf47d66"
  },
  "_meta": {
    "created_at_utc": "2026-02-24T07:24:14+00:00",
    "config_hash": "b196e415cb8b7ef6f9091b05a4101873f0fd8390d51ce767a7c4f02a1474f4fe",
    "model": "gemini",
    "backend": "gemini",
    "artifact_file": "casos/BOBS/2026-02-24/_votes/StepVote_v1_CATALYST_DETECTION__model_gemini_20260224T072414_0000.json"
  }
}