{
  "version_esquema": "StepVote_v1",
  "caso_id": "CASE_20260225_TEP",
  "ticker": "TEP",
  "fecha_caso": "2026-02-25",
  "step_name": "BULL__model_codex",
  "operation": "PIPELINE",
  "mode": "deterministic_only",
  "subject_type": "single_artifact",
  "schema_name": "AgentReport_v1",
  "score_raw_0_100": 97.81,
  "rules": [
    {
      "name": "schema_valid",
      "weight": 1.0,
      "score_raw_0_100": 100.0,
      "passed": true,
      "details": null
    },
    {
      "name": "critical_fields_completeness",
      "weight": 1.0,
      "score_raw_0_100": 100.0,
      "passed": true,
      "details": null
    },
    {
      "name": "null_ratio",
      "weight": 1.0,
      "score_raw_0_100": 93.44,
      "passed": true,
      "details": "nulls=28/427 (6.56%)"
    }
  ],
  "context": {
    "critical_fields_checked": 4,
    "critical_fields": [
      "resumen_ejecutivo.veredicto_role_local",
      "resumen_ejecutivo.confianza_0_1",
      "claims",
      "log.autochequeos"
    ],
    "canonical_step_name": "BULL",
    "subject_kind": "per_model",
    "vote_group_id": "ed160050-c169-43e5-af15-2a1e8e3e9c7e"
  },
  "_meta": {
    "created_at_utc": "2026-02-25T15:03:52+00:00",
    "config_hash": "b196e415cb8b7ef6f9091b05a4101873f0fd8390d51ce767a7c4f02a1474f4fe",
    "model": "codex",
    "backend": "codex",
    "artifact_file": "casos/TEP/2026-02-25/_votes/StepVote_v1_BULL__model_codex_20260225T150352_0000.json"
  }
}