{
  "version_esquema": "StepVote_v1",
  "caso_id": "CASE_20260221_ACVA",
  "ticker": "ACVA",
  "fecha_caso": "2026-02-21",
  "step_name": "CATALYST_SCORING",
  "operation": "PIPELINE",
  "mode": "deterministic_only",
  "subject_type": "single_artifact",
  "schema_name": "AgentReport_v1",
  "score_raw_0_100": 98.94,
  "rules": [
    {
      "name": "schema_valid",
      "weight": 1.0,
      "score_raw_0_100": 100.0,
      "passed": true,
      "details": null
    },
    {
      "name": "critical_fields_completeness",
      "weight": 1.0,
      "score_raw_0_100": 100.0,
      "passed": true,
      "details": null
    },
    {
      "name": "null_ratio",
      "weight": 1.0,
      "score_raw_0_100": 96.81,
      "passed": true,
      "details": "nulls=36/1127 (3.19%)"
    }
  ],
  "context": {
    "critical_fields_checked": 4,
    "critical_fields": [
      "resumen_ejecutivo.veredicto_role_local",
      "resumen_ejecutivo.confianza_0_1",
      "claims",
      "log.autochequeos"
    ],
    "canonical_step_name": "CATALYST_SCORING",
    "subject_kind": "fusion",
    "vote_group_id": "b9fee2a3-8b57-42c9-96a0-a2f707c0a3e8"
  },
  "_meta": {
    "created_at_utc": "2026-02-21T17:02:00+00:00",
    "config_hash": "b196e415cb8b7ef6f9091b05a4101873f0fd8390d51ce767a7c4f02a1474f4fe",
    "model": "opus",
    "backend": "claude",
    "artifact_file": "casos/ACVA/2026-02-21/_votes/StepVote_v1_CATALYST_SCORING_20260221T170200_0000.json"
  }
}