{
  "version_esquema": "StepVote_v1",
  "caso_id": "CASE_20260224_SONO",
  "ticker": "SONO",
  "fecha_caso": "2026-02-24",
  "step_name": "BULL__model_claude",
  "operation": "PIPELINE",
  "mode": "deterministic_only",
  "subject_type": "single_artifact",
  "schema_name": "AgentReport_v1",
  "score_raw_0_100": 100.0,
  "rules": [
    {
      "name": "schema_valid",
      "weight": 1.0,
      "score_raw_0_100": 100.0,
      "passed": true,
      "details": null
    },
    {
      "name": "critical_fields_completeness",
      "weight": 1.0,
      "score_raw_0_100": 100.0,
      "passed": true,
      "details": null
    },
    {
      "name": "null_ratio",
      "weight": 1.0,
      "score_raw_0_100": 100.0,
      "passed": true,
      "details": "nulls=0/360 (0.00%)"
    }
  ],
  "context": {
    "critical_fields_checked": 4,
    "critical_fields": [
      "resumen_ejecutivo.veredicto_role_local",
      "resumen_ejecutivo.confianza_0_1",
      "claims",
      "log.autochequeos"
    ],
    "canonical_step_name": "BULL",
    "subject_kind": "per_model",
    "vote_group_id": "887fee78-2384-4ed1-a912-a5aecdf275d8"
  },
  "_meta": {
    "created_at_utc": "2026-02-24T07:53:08+00:00",
    "config_hash": "b196e415cb8b7ef6f9091b05a4101873f0fd8390d51ce767a7c4f02a1474f4fe",
    "model": "claude",
    "backend": "claude",
    "artifact_file": "casos/SONO/2026-02-24/_votes/StepVote_v1_BULL__model_claude_20260224T075308_0000.json"
  }
}