{
  "version_esquema": "StepVote_v1",
  "caso_id": "CASE_20260224_ACLS",
  "ticker": "ACLS",
  "fecha_caso": "2026-02-24",
  "step_name": "IMPLIED",
  "operation": "PIPELINE",
  "mode": "deterministic_only",
  "subject_type": "single_artifact",
  "schema_name": "ImpliedExpectations_v1",
  "score_raw_0_100": 99.74,
  "rules": [
    {
      "name": "schema_valid",
      "weight": 1.0,
      "score_raw_0_100": 100.0,
      "passed": true,
      "details": null
    },
    {
      "name": "critical_fields_completeness",
      "weight": 1.0,
      "score_raw_0_100": 100.0,
      "passed": true,
      "details": null
    },
    {
      "name": "null_ratio",
      "weight": 1.0,
      "score_raw_0_100": 99.23,
      "passed": true,
      "details": "nulls=2/260 (0.77%)"
    }
  ],
  "context": {
    "critical_fields_checked": 4,
    "critical_fields": [
      "status",
      "snapshot_mercado.market_cap_usd",
      "metricas_base.ingresos_usd",
      "resumen_expectativas_implicitas.enunciados"
    ],
    "canonical_step_name": "IMPLIED",
    "subject_kind": "fusion"
  },
  "_meta": {
    "created_at_utc": "2026-02-24T07:13:13+00:00",
    "config_hash": "b196e415cb8b7ef6f9091b05a4101873f0fd8390d51ce767a7c4f02a1474f4fe",
    "model": "opus",
    "backend": "claude",
    "artifact_file": "casos/ACLS/2026-02-24/_votes/StepVote_v1_IMPLIED_20260224T071313_0000.json"
  }
}