{
  "version_esquema": "StepVote_v1",
  "caso_id": "CASE_20260217_SOM",
  "ticker": "SOM",
  "fecha_caso": "2026-02-17",
  "step_name": "TP_EXTRACTOR_FILING",
  "operation": "PIPELINE",
  "mode": "deterministic_only",
  "subject_type": "tp_extractor_filing_aggregate",
  "schema_name": null,
  "score_raw_0_100": 72.22,
  "rules": [
    {
      "name": "filing_sections_completeness",
      "weight": 1.0,
      "score_raw_0_100": 72.22,
      "passed": true,
      "details": "valid_filings=6/6"
    }
  ],
  "context": {
    "filings_total": 6,
    "filings_valid": 6,
    "filings": [
      {
        "filing_index": 0,
        "valid": true,
        "score_raw_0_100": 100.0,
        "errors": []
      },
      {
        "filing_index": 1,
        "valid": true,
        "score_raw_0_100": 66.67,
        "errors": []
      },
      {
        "filing_index": 2,
        "valid": true,
        "score_raw_0_100": 33.33,
        "errors": []
      },
      {
        "filing_index": 3,
        "valid": true,
        "score_raw_0_100": 100.0,
        "errors": []
      },
      {
        "filing_index": 5,
        "valid": true,
        "score_raw_0_100": 100.0,
        "errors": []
      },
      {
        "filing_index": 6,
        "valid": true,
        "score_raw_0_100": 33.33,
        "errors": []
      }
    ],
    "sections_scored": [
      "historico_anual",
      "historico_trimestral",
      "balance_sheet_ultimo"
    ]
  },
  "_meta": {
    "created_at_utc": "2026-02-18T10:04:43+00:00",
    "config_hash": "156c91552bdcb2695b10fffd6cb82cfced011aa00be90d0420e2de130dab9054",
    "model": "gpt-5.3-codex",
    "backend": "codex",
    "artifact_file": "casos/SOM/2026-02-17/_votes/StepVote_v1_TP_EXTRACTOR_FILING_20260218T100443_0000.json"
  }
}