{
  "version_esquema": "StepVote_v1",
  "caso_id": "CASE_20260222_KAR",
  "ticker": "KAR",
  "fecha_caso": "2026-02-22",
  "step_name": "FORENSIC_DETECTION__model_claude",
  "operation": "PIPELINE",
  "mode": "deterministic_only",
  "subject_type": "single_artifact",
  "schema_name": "ForensicDetection_v1",
  "score_raw_0_100": 99.66,
  "rules": [
    {
      "name": "schema_valid",
      "weight": 1.0,
      "score_raw_0_100": 100.0,
      "passed": true,
      "details": null
    },
    {
      "name": "critical_fields_completeness",
      "weight": 1.0,
      "score_raw_0_100": 100.0,
      "passed": true,
      "details": "no_critical_fields_configured"
    },
    {
      "name": "null_ratio",
      "weight": 1.0,
      "score_raw_0_100": 98.99,
      "passed": true,
      "details": "nulls=2/199 (1.01%)"
    }
  ],
  "context": {
    "critical_fields_checked": 0,
    "critical_fields": [],
    "canonical_step_name": "FORENSIC_DETECTION",
    "subject_kind": "per_model",
    "vote_group_id": "6879e143-bad9-4adf-bc92-9b458cd633d0"
  },
  "_meta": {
    "created_at_utc": "2026-02-22T10:26:52+00:00",
    "config_hash": "b196e415cb8b7ef6f9091b05a4101873f0fd8390d51ce767a7c4f02a1474f4fe",
    "model": "claude",
    "backend": "claude",
    "artifact_file": "casos/KAR/2026-02-22/_votes/StepVote_v1_FORENSIC_DETECTION__model_claude_20260222T102652_0000.json"
  }
}