{
  "version_esquema": "StepVote_v1",
  "caso_id": "CASE_20260225_TEP",
  "ticker": "TEP",
  "fecha_caso": "2026-02-25",
  "step_name": "CATALYST_DETECTION__model_claude",
  "operation": "PIPELINE",
  "mode": "deterministic_only",
  "subject_type": "single_artifact",
  "schema_name": "CatalystDetection_v1",
  "score_raw_0_100": 100.0,
  "rules": [
    {
      "name": "schema_valid",
      "weight": 1.0,
      "score_raw_0_100": 100.0,
      "passed": true,
      "details": null
    },
    {
      "name": "critical_fields_completeness",
      "weight": 1.0,
      "score_raw_0_100": 100.0,
      "passed": true,
      "details": "no_critical_fields_configured"
    },
    {
      "name": "null_ratio",
      "weight": 1.0,
      "score_raw_0_100": 100.0,
      "passed": true,
      "details": "nulls=0/290 (0.00%)"
    }
  ],
  "context": {
    "critical_fields_checked": 0,
    "critical_fields": [],
    "canonical_step_name": "CATALYST_DETECTION",
    "subject_kind": "per_model",
    "vote_group_id": "31117e91-6242-4459-bbaf-6bd982c5aa51"
  },
  "_meta": {
    "created_at_utc": "2026-02-25T09:57:10+00:00",
    "config_hash": "b196e415cb8b7ef6f9091b05a4101873f0fd8390d51ce767a7c4f02a1474f4fe",
    "model": "claude",
    "backend": "claude",
    "artifact_file": "casos/TEP/2026-02-25/_votes/StepVote_v1_CATALYST_DETECTION__model_claude_20260225T095710_0000.json"
  }
}