{
  "version_esquema": "StepVote_v1",
  "caso_id": "CASE_20260224_BOBS",
  "ticker": "BOBS",
  "fecha_caso": "2026-02-24",
  "step_name": "FORENSIC_DETECTION__model_codex",
  "operation": "PIPELINE",
  "mode": "deterministic_only",
  "subject_type": "single_artifact",
  "schema_name": "ForensicDetection_v1",
  "score_raw_0_100": 99.89,
  "rules": [
    {
      "name": "schema_valid",
      "weight": 1.0,
      "score_raw_0_100": 100.0,
      "passed": true,
      "details": null
    },
    {
      "name": "critical_fields_completeness",
      "weight": 1.0,
      "score_raw_0_100": 100.0,
      "passed": true,
      "details": "no_critical_fields_configured"
    },
    {
      "name": "null_ratio",
      "weight": 1.0,
      "score_raw_0_100": 99.66,
      "passed": true,
      "details": "nulls=1/290 (0.34%)"
    }
  ],
  "context": {
    "critical_fields_checked": 0,
    "critical_fields": [],
    "canonical_step_name": "FORENSIC_DETECTION",
    "subject_kind": "per_model",
    "vote_group_id": "e400a160-aa26-4cad-a1e0-e674978842af"
  },
  "_meta": {
    "created_at_utc": "2026-02-24T10:06:58+00:00",
    "config_hash": "b196e415cb8b7ef6f9091b05a4101873f0fd8390d51ce767a7c4f02a1474f4fe",
    "model": "codex",
    "backend": "codex",
    "artifact_file": "casos/BOBS/2026-02-24/_votes/StepVote_v1_FORENSIC_DETECTION__model_codex_20260224T100658_0000.json"
  }
}