{
  "version_esquema": "StepVote_v1",
  "caso_id": "CASE_20260223_EVER",
  "ticker": "EVER",
  "fecha_caso": "2026-02-23",
  "step_name": "BULL__model_claude",
  "operation": "PIPELINE",
  "mode": "deterministic_only",
  "subject_type": "single_artifact",
  "schema_name": "AgentReport_v1",
  "score_raw_0_100": 97.97,
  "rules": [
    {
      "name": "schema_valid",
      "weight": 1.0,
      "score_raw_0_100": 100.0,
      "passed": true,
      "details": null
    },
    {
      "name": "critical_fields_completeness",
      "weight": 1.0,
      "score_raw_0_100": 100.0,
      "passed": true,
      "details": null
    },
    {
      "name": "null_ratio",
      "weight": 1.0,
      "score_raw_0_100": 93.9,
      "passed": true,
      "details": "nulls=23/377 (6.10%)"
    }
  ],
  "context": {
    "critical_fields_checked": 4,
    "critical_fields": [
      "resumen_ejecutivo.veredicto_role_local",
      "resumen_ejecutivo.confianza_0_1",
      "claims",
      "log.autochequeos"
    ],
    "canonical_step_name": "BULL",
    "subject_kind": "per_model",
    "vote_group_id": "d4178528-e96e-4369-90dc-045a9b4faf21"
  },
  "_meta": {
    "created_at_utc": "2026-02-24T09:43:26+00:00",
    "config_hash": "b196e415cb8b7ef6f9091b05a4101873f0fd8390d51ce767a7c4f02a1474f4fe",
    "model": "claude",
    "backend": "claude",
    "artifact_file": "casos/EVER/2026-02-23/_votes/StepVote_v1_BULL__model_claude_20260224T094326_0000.json"
  }
}