{
  "version_esquema": "StepVote_v1",
  "caso_id": "CASE_20260225_TEP",
  "ticker": "TEP",
  "fecha_caso": "2026-02-25",
  "step_name": "RED_TEAM",
  "operation": "PIPELINE",
  "mode": "deterministic_only",
  "subject_type": "single_artifact",
  "schema_name": "AgentReport_v1",
  "score_raw_0_100": 98.86,
  "rules": [
    {
      "name": "schema_valid",
      "weight": 1.0,
      "score_raw_0_100": 100.0,
      "passed": true,
      "details": null
    },
    {
      "name": "critical_fields_completeness",
      "weight": 1.0,
      "score_raw_0_100": 100.0,
      "passed": true,
      "details": null
    },
    {
      "name": "null_ratio",
      "weight": 1.0,
      "score_raw_0_100": 96.57,
      "passed": true,
      "details": "nulls=20/583 (3.43%)"
    }
  ],
  "context": {
    "critical_fields_checked": 4,
    "critical_fields": [
      "resumen_ejecutivo.veredicto_role_local",
      "resumen_ejecutivo.confianza_0_1",
      "claims",
      "log.autochequeos"
    ],
    "canonical_step_name": "RED_TEAM",
    "subject_kind": "fusion",
    "vote_group_id": "681c04c3-3ed7-416c-a53d-2ba9b5da0e3d"
  },
  "_meta": {
    "created_at_utc": "2026-02-26T19:05:13+00:00",
    "config_hash": "b196e415cb8b7ef6f9091b05a4101873f0fd8390d51ce767a7c4f02a1474f4fe",
    "model": "gpt-5.3-codex",
    "backend": "codex",
    "artifact_file": "casos/TEP/2026-02-25/_votes/StepVote_v1_RED_TEAM_20260226T190513_0000.json"
  }
}