{
  "version_esquema": "StepVote_v1",
  "caso_id": "CASE_20260224_BOBS",
  "ticker": "BOBS",
  "fecha_caso": "2026-02-24",
  "step_name": "ARBITRO__model_codex",
  "operation": "PIPELINE",
  "mode": "deterministic_only",
  "subject_type": "single_artifact",
  "schema_name": "DecisionPacket_v2",
  "score_raw_0_100": 100.0,
  "rules": [
    {
      "name": "schema_valid",
      "weight": 1.0,
      "score_raw_0_100": 100.0,
      "passed": true,
      "details": null
    },
    {
      "name": "critical_fields_completeness",
      "weight": 1.0,
      "score_raw_0_100": 100.0,
      "passed": true,
      "details": null
    },
    {
      "name": "null_ratio",
      "weight": 1.0,
      "score_raw_0_100": 100.0,
      "passed": true,
      "details": "nulls=0/1254 (0.00%)"
    }
  ],
  "context": {
    "critical_fields_checked": 5,
    "critical_fields": [
      "resumen_ejecutivo.decision",
      "resumen_ejecutivo.confianza_global_0_1",
      "gates.data_quality_gate.status",
      "gates.non_speculative_gate.status",
      "decision_probabilistica.probabilidad_exito_0_1"
    ],
    "canonical_step_name": "ARBITRO",
    "subject_kind": "per_model",
    "vote_group_id": "e44a29e4-f0dc-401a-949d-3ed41085cc51"
  },
  "_meta": {
    "created_at_utc": "2026-02-24T11:15:51+00:00",
    "config_hash": "b196e415cb8b7ef6f9091b05a4101873f0fd8390d51ce767a7c4f02a1474f4fe",
    "model": "codex",
    "backend": "codex",
    "artifact_file": "casos/BOBS/2026-02-24/_votes/StepVote_v1_ARBITRO__model_codex_20260224T111551_0000.json"
  }
}