{
  "version_esquema": "StepVote_v1",
  "caso_id": "CASE_20260225_TEP",
  "ticker": "TEP",
  "fecha_caso": "2026-02-25",
  "step_name": "TP_EXTRACTOR_FILING",
  "operation": "PIPELINE",
  "mode": "deterministic_only",
  "subject_type": "tp_extractor_filing_aggregate",
  "schema_name": null,
  "score_raw_0_100": 70.0,
  "rules": [
    {
      "name": "filing_sections_completeness",
      "weight": 1.0,
      "score_raw_0_100": 70.0,
      "passed": true,
      "details": "valid_filings=10/10"
    }
  ],
  "context": {
    "filings_total": 10,
    "filings_valid": 10,
    "filings": [
      {
        "filing_index": 0,
        "valid": true,
        "score_raw_0_100": 100.0,
        "errors": []
      },
      {
        "filing_index": 1,
        "valid": true,
        "score_raw_0_100": 66.67,
        "errors": []
      },
      {
        "filing_index": 2,
        "valid": true,
        "score_raw_0_100": 100.0,
        "errors": []
      },
      {
        "filing_index": 3,
        "valid": true,
        "score_raw_0_100": 66.67,
        "errors": []
      },
      {
        "filing_index": 4,
        "valid": true,
        "score_raw_0_100": 66.67,
        "errors": []
      },
      {
        "filing_index": 5,
        "valid": true,
        "score_raw_0_100": 66.67,
        "errors": []
      },
      {
        "filing_index": 6,
        "valid": true,
        "score_raw_0_100": 33.33,
        "errors": []
      },
      {
        "filing_index": 7,
        "valid": true,
        "score_raw_0_100": 66.67,
        "errors": []
      },
      {
        "filing_index": 8,
        "valid": true,
        "score_raw_0_100": 66.67,
        "errors": []
      },
      {
        "filing_index": 9,
        "valid": true,
        "score_raw_0_100": 66.67,
        "errors": []
      }
    ],
    "sections_scored": [
      "historico_anual",
      "historico_trimestral",
      "balance_sheet_ultimo"
    ],
    "canonical_step_name": "TP_EXTRACTOR_FILING",
    "subject_kind": "fusion"
  },
  "_meta": {
    "created_at_utc": "2026-02-26T17:12:39+00:00",
    "config_hash": "b196e415cb8b7ef6f9091b05a4101873f0fd8390d51ce767a7c4f02a1474f4fe",
    "model": "gpt-5.3-codex",
    "backend": "codex",
    "artifact_file": "casos/TEP/2026-02-25/_votes/StepVote_v1_TP_EXTRACTOR_FILING_20260226T171239_0000.json"
  }
}