{
  "version_esquema": "StepVote_v1",
  "caso_id": "CASE_20260222_KAR",
  "ticker": "KAR",
  "fecha_caso": "2026-02-22",
  "step_name": "FORENSIC_SCORING__model_codex",
  "operation": "PIPELINE",
  "mode": "deterministic_only",
  "subject_type": "single_artifact",
  "schema_name": "AgentReport_v1",
  "score_raw_0_100": 99.05,
  "rules": [
    {
      "name": "schema_valid",
      "weight": 1.0,
      "score_raw_0_100": 100.0,
      "passed": true,
      "details": null
    },
    {
      "name": "critical_fields_completeness",
      "weight": 1.0,
      "score_raw_0_100": 100.0,
      "passed": true,
      "details": null
    },
    {
      "name": "null_ratio",
      "weight": 1.0,
      "score_raw_0_100": 97.16,
      "passed": true,
      "details": "nulls=18/634 (2.84%)"
    }
  ],
  "context": {
    "critical_fields_checked": 4,
    "critical_fields": [
      "resumen_ejecutivo.veredicto_role_local",
      "resumen_ejecutivo.confianza_0_1",
      "claims",
      "log.autochequeos"
    ],
    "canonical_step_name": "FORENSIC_SCORING",
    "subject_kind": "per_model",
    "vote_group_id": "8fb09e0a-71f6-4221-9375-b08c79a2df21"
  },
  "_meta": {
    "created_at_utc": "2026-02-22T10:39:31+00:00",
    "config_hash": "b196e415cb8b7ef6f9091b05a4101873f0fd8390d51ce767a7c4f02a1474f4fe",
    "model": "codex",
    "backend": "codex",
    "artifact_file": "casos/KAR/2026-02-22/_votes/StepVote_v1_FORENSIC_SCORING__model_codex_20260222T103931_0000.json"
  }
}